{
  "$schema": "https://json-schema.org/draft/2020-12/schema",
  "$id": "fff.densou.seriesManifest.v1.1",
  "title": "Densou Developed Series Manifest",
  "type": "object",
  "additionalProperties": false,
  "required": [
    "schema_version",
    "schema_lineage",
    "artifact_id",
    "series_id",
    "material_label",
    "source_basis_id",
    "source_packet_id",
    "source_revision_id",
    "series_form",
    "audience_language",
    "series_promise_ja",
    "state",
    "seasons",
    "boundaries"
  ],
  "properties": {
    "schema_version": {
      "const": "fff.densou.seriesManifest.v1.1"
    },
    "schema_lineage": {
      "const": "fff.densou.seriesManifest.v1"
    },
    "artifact_id": {
      "const": "fff-densou-series-episode-quickwin-001"
    },
    "series_id": {
      "const": "densou-series"
    },
    "material_label": {
      "const": "デンソウ"
    },
    "source_basis_id": {
      "type": "string",
      "pattern": "^fff-densou-source-basis-[0-9a-f]{16}$"
    },
    "source_packet_id": {
      "type": "string",
      "minLength": 1
    },
    "source_revision_id": {
      "type": "string",
      "pattern": "^densou-[0-9a-f]{16}$"
    },
    "series_form": {
      "const": "long_form_evidence_led_mystery_serial"
    },
    "audience_language": {
      "type": "string",
      "minLength": 1
    },
    "series_promise_ja": {
      "type": "string",
      "minLength": 1
    },
    "state": {
      "const": "season_01_episode_01_quickwin_ready_for_local_review"
    },
    "seasons": {
      "type": "array",
      "minItems": 1,
      "items": {
        "type": "object",
        "additionalProperties": false,
        "required": [
          "season_id",
          "manifest_path",
          "state"
        ],
        "properties": {
          "season_id": {
            "const": "densou-season-01"
          },
          "manifest_path": {
            "const": "season-01-manifest.json"
          },
          "state": {
            "const": "episode_01_ready_later_slots_question_bound"
          }
        }
      }
    },
    "boundaries": {
      "type": "object",
      "additionalProperties": false,
      "required": [
        "final_canon",
        "rights_clearance",
        "production_approval",
        "publication",
        "upload",
        "release",
        "external_provider",
        "credentials",
        "voice_audio_video_generation"
      ],
      "properties": {
        "final_canon": {
          "const": false
        },
        "rights_clearance": {
          "const": false
        },
        "production_approval": {
          "const": false
        },
        "publication": {
          "const": false
        },
        "upload": {
          "const": false
        },
        "release": {
          "const": false
        },
        "external_provider": {
          "const": false
        },
        "credentials": {
          "const": false
        },
        "voice_audio_video_generation": {
          "const": false
        }
      }
    }
  }
}
